{
  "contract": "szl.khipu-command-system/v1",
  "recordKind": "SAMPLE",
  "surfaceId": "example-command-surface",
  "audience": "EXECUTIVE",
  "source": {
    "repository": "https://example.invalid/source",
    "revision": "0000000000000000000000000000000000000000",
    "kanchayManifestRoot": "0000000000000000000000000000000000000000000000000000000000000000"
  },
  "responsive": {
    "testedViewportsCssPx": [360, 390, 768, 1024, 1440],
    "zoomPercent": [200, 400],
    "bodyMeasureCh": 72
  },
  "accessibility": {
    "minimumTargetCssPx": 44,
    "focusVisible": true,
    "keyboardOnly": true,
    "reducedMotion": true,
    "nonColorStatus": true,
    "semanticLandmarks": true
  },
  "executiveBrief": {
    "category": "Governed command infrastructure",
    "primaryAudience": "Regulated operations leaders",
    "outcome": "Review a bounded decision and its evidence before authorizing action.",
    "primaryAction": "Open the governed workflow",
    "evidenceAction": "Inspect the independent receipt",
    "boundary": "This sample describes the disclosure format; it does not claim a live deployment."
  },
  "evidence": [
    {
      "claim": "The example illustrates a modeled command-surface disclosure.",
      "evidenceClass": "MODELED",
      "operationalState": "UNAVAILABLE",
      "sourceUrl": "https://example.invalid/evidence",
      "scope": "Static sample content included with the KHIPU Command System contract.",
      "limitations": [
        "No runtime, customer environment, or deployment is represented by this sample."
      ]
    }
  ],
  "links": {
    "product": "https://example.invalid/product",
    "documentation": "https://example.invalid/docs",
    "source": "https://example.invalid/source",
    "evidence": "https://example.invalid/evidence"
  }
}
